
<xs:schema xmlns:xs="http://www.w3.org/2001/XMLSchema" elementFormDefault="qualified" attributeFormDefault="unqualified">
	<xs:element name="tone_root">
		<xs:complexType>
			<xs:sequence>
				<xs:element name="tone" minOccurs="0" maxOccurs="unbounded">
					<xs:complexType>
						<xs:sequence>
							<xs:element name="nodeid"  minOccurs="1" maxOccurs="1">
								<xs:simpleType>
									<xs:restriction base = "xs:int"/>
								</xs:simpleType>
							</xs:element>
							<xs:element name="toneid"  minOccurs="1" maxOccurs="1">
								<xs:simpleType>
									<xs:restriction base = "xs:short"/>
								</xs:simpleType>
							</xs:element>
							<xs:element name="tone_ctg"  minOccurs="1" maxOccurs="1">
								<xs:simpleType>
									<xs:restriction base = "xs:short"/>
								</xs:simpleType>
							</xs:element>
							<xs:element name="cn_treat"  minOccurs="1" maxOccurs="1">
								<xs:simpleType>
									<xs:restriction base = "xs:short"/>
								</xs:simpleType>
							</xs:element>
							<xs:element name="periods"  minOccurs="1" maxOccurs="1">
								<xs:simpleType>
									<xs:restriction base = "xs:short"/>
								</xs:simpleType>
							</xs:element>
							</xs:sequence>
					</xs:complexType>
				</xs:element>
			<xs:element name="tone_phase" minOccurs="0" maxOccurs="unbounded">
					<xs:complexType>
						<xs:sequence>
							<xs:element name="nodeid"  minOccurs="1" maxOccurs="1">
								<xs:simpleType>
									<xs:restriction base = "xs:int"/>
								</xs:simpleType>
							</xs:element>
							<xs:element name="toneid"  minOccurs="1" maxOccurs="1">
								<xs:simpleType>
									<xs:restriction base = "xs:short"/>
								</xs:simpleType>
							</xs:element>
							<xs:element name="phaseid"  minOccurs="1" maxOccurs="1">
								<xs:simpleType>
									<xs:restriction base = "xs:short"/>
								</xs:simpleType>
							</xs:element>
							<xs:element name="phaselen"  minOccurs="1" maxOccurs="1">
								<xs:simpleType>
									<xs:restriction base = "xs:short"/>
								</xs:simpleType>
							</xs:element>
							<xs:element name="intrptblty"  minOccurs="1" maxOccurs="1">
								<xs:simpleType>
									<xs:restriction base = "xs:short"/>
								</xs:simpleType>
							</xs:element>
							<xs:element name="tone_sigid"  minOccurs="1" maxOccurs="1">
								<xs:simpleType>
									<xs:restriction base = "xs:short"/>
								</xs:simpleType>
							</xs:element>
							</xs:sequence>
					</xs:complexType>
				</xs:element>
			<xs:element name="tone_signal" minOccurs="0" maxOccurs="unbounded">
					<xs:complexType>
						<xs:sequence>
							<xs:element name="nodeid"  minOccurs="1" maxOccurs="1">
								<xs:simpleType>
									<xs:restriction base = "xs:int"/>
								</xs:simpleType>
							</xs:element>
							<xs:element name="tone_sigid"  minOccurs="1" maxOccurs="1">
								<xs:simpleType>
									<xs:restriction base = "xs:short"/>
								</xs:simpleType>
							</xs:element>
							<xs:element name="frequency1"  minOccurs="1" maxOccurs="1">
								<xs:simpleType>
									<xs:restriction base = "xs:short"/>
								</xs:simpleType>
							</xs:element>
							<xs:element name="level1_db"  minOccurs="1" maxOccurs="1">
								<xs:simpleType>
									<xs:restriction base = "xs:short"/>
								</xs:simpleType>
							</xs:element>
							<xs:element name="frequency2"  minOccurs="1" maxOccurs="1">
								<xs:simpleType>
									<xs:restriction base = "xs:short"/>
								</xs:simpleType>
							</xs:element>
							<xs:element name="level2_db"  minOccurs="1" maxOccurs="1">
								<xs:simpleType>
									<xs:restriction base = "xs:short"/>
								</xs:simpleType>
							</xs:element>
							</xs:sequence>
					</xs:complexType>
				</xs:element>
			</xs:sequence>
		</xs:complexType>
		<xs:key name="XPKtone">
			<xs:selector xpath=".//tone"/>
			<xs:field xpath="nodeid"/>
			<xs:field xpath="toneid"/>
			</xs:key>
		<xs:key name="XPKtone_phase">
			<xs:selector xpath=".//tone_phase"/>
			<xs:field xpath="nodeid"/>
			<xs:field xpath="toneid"/>
			<xs:field xpath="phaseid"/>
			</xs:key>
		<xs:key name="XPKtone_signal">
			<xs:selector xpath=".//tone_signal"/>
			<xs:field xpath="nodeid"/>
			<xs:field xpath="tone_sigid"/>
			</xs:key>
		
		
		
		<xs:keyref name="XIF1tone_phase"  refer="XPKtone">
			<xs:selector xpath=".//tone_phase"/>
			<xs:field xpath="nodeid"/>
			<xs:field xpath="toneid"/>
			</xs:keyref>
		
	</xs:element>
</xs:schema>
